{
  "vct": "eu.we-build:contactperson:1",
  "iss": "did:example:webuild-company-456",
  "iat": 1736935200,
  "exp": 1768471200,
  "attestation_legal_category": "EAA",
  "schema_version": "1.0",
  "trust_anchor_url": "https://trust.webuildconsortium.eu/anchors/eidas-tl",
  "legal_entity": {
    "legal_person": {
      "legal_person_name": "Example GmbH",
      "legal_form_type": "GmbH"
    },
    "identifier": {
      "euid": "DE1212.HRB123456",
      "tax": "DE123456789"
    }
  },
  "contact_persons": [
    {
      "given_name": "Anna",
      "family_name": "Schmidt",
      "role": "logistics",
      "email": "anna.schmidt@example.com",
      "telephone": "+4915123456789"
    },
    {
      "given_name": "Max",
      "family_name": "Mustermann",
      "role": "finance",
      "email": "max.mustermann@example.com"
    }
  ],
  "status": {
    "type": "status-list",
    "status_list_credential": "https://issuer.example.com/status/contactperson/2026",
    "status_list_index": 321,
    "status_purpose": "revocation"
  },
  "cnf": {
    "jwk": {
      "kty": "EC",
      "crv": "P-256",
      "x": "TCAER19Zvu3OHF4j4W4vfSVoHIP1ILilDls7vCeGemc",
      "y": "ZxjiWWbZMQGHVWKVQ4hbSIirsVfuecCE6t4jT9F2HZQ"
    }
  }
}